{
  "schemaVersion": "1.0.0",
  "turnId": "turn_16GOLDENUSER000000000000001",
  "projectId": "proj_16GOLDENVIB0000000000000001",
  "userFacingMessage": "I initialized the ESP32 IMU Vibration Monitor golden project with requirements R1–R8, functional architecture (I2C GPIO21/22, 115200 telemetry), FX-MCU-32/FX-IMU-200 component plan, Test Plan T1–T8 (R7 closed via Analysis evidence), Risk Register K1–K6 (K6 monitoring without hardware evidence), and a next action to compile firmware and run Analysis R7 verification.",
  "createdArtifactReferences": [
    {
      "artifactType": "project-brief",
      "artifactId": "art_16GOLDENBRIEF00000000000001",
      "artifactVersion": 1,
      "contentSchemaVersion": "1.0.0"
    },
    {
      "artifactType": "requirement-set",
      "artifactId": "art_16GOLDENREQS000000000000001",
      "artifactVersion": 1,
      "contentSchemaVersion": "1.0.0"
    },
    {
      "artifactType": "functional-architecture",
      "artifactId": "art_16GOLDENARCH00000000000001",
      "artifactVersion": 1,
      "contentSchemaVersion": "1.0.0"
    },
    {
      "artifactType": "next-action",
      "artifactId": "art_16GOLDENNEXT00000000000001",
      "artifactVersion": 1,
      "contentSchemaVersion": "1.0.0"
    },
    {
      "artifactType": "component-plan",
      "artifactId": "art_16GOLDENCPLAN0000000000001",
      "artifactVersion": 1,
      "contentSchemaVersion": "1.0.0"
    },
    {
      "artifactType": "test-plan",
      "artifactId": "art_16GOLDENTESTPLAN0000000000001",
      "artifactVersion": 1,
      "contentSchemaVersion": "1.0.0"
    },
    {
      "artifactType": "risk-register",
      "artifactId": "art_16GOLDENRISKREG0000000000001",
      "artifactVersion": 1,
      "contentSchemaVersion": "1.0.0"
    }
  ],
  "warningIssueReferences": [],
  "blockerIssueReferences": [],
  "openQuestionReferences": [],
  "nextActionArtifactReference": {
    "artifactType": "next-action",
    "artifactId": "art_16GOLDENNEXT00000000000001",
    "artifactVersion": 1,
    "contentSchemaVersion": "1.0.0"
  },
  "projectStateSummary": {
    "projectPhase": "concept",
    "autonomyMode": "collaborate",
    "openQuestionCount": 0,
    "validationIssueCount": 0
  },
  "completionStatus": "completed"
}
