{
  "schemaVersion": "1.0.0",
  "turnId": "turn_05USERMSG0000000000000001",
  "projectId": "proj_05ROBOTPROJ0000000000000001",
  "userFacingMessage": "I captured your robot obstacle-detection module idea and produced a functional first architecture that detects objects in front, produces timestamped obstacle evidence, decides timely reactions to avoid collisions, and interfaces with the robot controller while keeping detection range/FOV, reaction latency, controller interface semantics, and indoor safety/fail-safe assumptions as open questions. Next, confirm these constraints so later embedded component selection stays grounded.",
  "createdArtifactReferences": [
    {
      "artifactType": "project-brief",
      "artifactId": "art_05ROBOTPB000000000000000001",
      "artifactVersion": 1,
      "contentSchemaVersion": "1.0.0"
    },
    {
      "artifactType": "requirement-set",
      "artifactId": "art_05ROBOTREQ000000000000000001",
      "artifactVersion": 1,
      "contentSchemaVersion": "1.0.0"
    },
    {
      "artifactType": "functional-architecture",
      "artifactId": "art_05ROBOTARCH00000000000000001",
      "artifactVersion": 1,
      "contentSchemaVersion": "1.0.0"
    },
    {
      "artifactType": "next-action",
      "artifactId": "art_05ROBOTNXT000000000000000001",
      "artifactVersion": 1,
      "contentSchemaVersion": "1.0.0"
    },
    {
      "artifactType": "component-plan",
      "artifactId": "art_2E3C90FB8D81A2272DD0CP01",
      "artifactVersion": 1,
      "contentSchemaVersion": "1.0.0"
    }
  ],
  "warningIssueReferences": [
    {
      "issueId": "issue_05WARNFALSEPOSNEGCASESUNCLEAR000000000000001"
    }
  ],
  "blockerIssueReferences": [
    {
      "issueId": "issue_05BLOCKOBSTACLECONSTRAINTSINTERFACEENVUNKNOWN000000000000001"
    }
  ],
  "openQuestionReferences": [
    {
      "schemaVersion": "1.0.0",
      "questionId": "question_05DETECTIONRANGEFOVUNKNOWN000000000000001",
      "displayId": "Q1"
    },
    {
      "schemaVersion": "1.0.0",
      "questionId": "question_05REACTIONLATENCYUNKNOWN000000000000001",
      "displayId": "Q2"
    },
    {
      "schemaVersion": "1.0.0",
      "questionId": "question_05ROBOTCONTROLLERINTERFACEUNKNOWN0000000000001",
      "displayId": "Q3"
    },
    {
      "schemaVersion": "1.0.0",
      "questionId": "question_05ENVIRONMENTSAFETYUNKNOWN000000000000001",
      "displayId": "Q4"
    }
  ],
  "nextActionArtifactReference": {
    "artifactType": "next-action",
    "artifactId": "art_05ROBOTNXT000000000000000001",
    "artifactVersion": 1,
    "contentSchemaVersion": "1.0.0"
  },
  "projectStateSummary": {
    "projectPhase": "concept",
    "autonomyMode": "delegate",
    "openQuestionCount": 4,
    "validationIssueCount": 2
  },
  "completionStatus": "completed-with-warnings"
}
