{
  "schemaVersion": "1.0.0",
  "turnId": "turn_04USERMSG0000000000000001",
  "projectId": "proj_04VIBRATIONPROJ0000000000000001",
  "userFacingMessage": "I captured your vibration-monitoring device idea and produced a functional first architecture that attaches to a machine context, records timestamped vibration data, stores analysis-ready logs, and supports later change-detection analysis while keeping bandwidth, dynamic range, recording mode, and mounting/baseline constraints as open questions. Next, confirm these measurement and mounting needs so later embedded component selection stays grounded.",
  "createdArtifactReferences": [
    {
      "artifactType": "project-brief",
      "artifactId": "art_04VIBRATIONPB000000000000000001",
      "artifactVersion": 1,
      "contentSchemaVersion": "1.0.0"
    },
    {
      "artifactType": "requirement-set",
      "artifactId": "art_04VIBRATIONREQ000000000000000001",
      "artifactVersion": 1,
      "contentSchemaVersion": "1.0.0"
    },
    {
      "artifactType": "functional-architecture",
      "artifactId": "art_04VIBRATIONARCH00000000000000001",
      "artifactVersion": 1,
      "contentSchemaVersion": "1.0.0"
    },
    {
      "artifactType": "next-action",
      "artifactId": "art_04VIBRATIONNXT000000000000000001",
      "artifactVersion": 1,
      "contentSchemaVersion": "1.0.0"
    }
  ],
  "warningIssueReferences": [
    {
      "issueId": "issue_04WARNBASELINECALIBRATIONMETHODOLOGYUNCLEAR000000000000001"
    }
  ],
  "blockerIssueReferences": [
    {
      "issueId": "issue_04BLOCKVIBRATIONRANGERECORDINGMOUNTUNKNOWN000000000000001"
    }
  ],
  "openQuestionReferences": [
    {
      "schemaVersion": "1.0.0",
      "questionId": "question_04VIBRATIONFREQUENCYBANDWIDTHUNKNOWN000000000000001",
      "displayId": "Q1"
    },
    {
      "schemaVersion": "1.0.0",
      "questionId": "question_04SAMPLERATERECORDINGMODEUNKNOWN00000000000001",
      "displayId": "Q2"
    },
    {
      "schemaVersion": "1.0.0",
      "questionId": "question_04DYNAMICRANGEACCELUNKNOWN000000000000001",
      "displayId": "Q3"
    },
    {
      "schemaVersion": "1.0.0",
      "questionId": "question_04MOUNTINGBASELINECALIBRATIONUNKNOWN000000000001",
      "displayId": "Q4"
    }
  ],
  "nextActionArtifactReference": {
    "artifactType": "next-action",
    "artifactId": "art_04VIBRATIONNXT000000000000000001",
    "artifactVersion": 1,
    "contentSchemaVersion": "1.0.0"
  },
  "projectStateSummary": {
    "projectPhase": "concept",
    "autonomyMode": "delegate",
    "openQuestionCount": 4,
    "validationIssueCount": 2
  },
  "completionStatus": "completed-with-warnings"
}

